{
  "schema_version": 1,
  "run_id": "cpu-stub-0fc1a55a6843ce11-12345",
  "timestamp_utc": "2026-07-28T01:26:44Z",
  "source": {"commit": "d0158e190fce54ebafc7b14a94f397852f4ec489", "dirty": true},
  "build": {"compiler": "AppleClang", "compiler_version": "21.0.0 (clang-2100.1.1.101)", "build_type": "local"},
  "host": {"os": "macOS", "os_version": "27.0.0", "architecture": "arm64"},
  "backend": {"api": "stub", "status": "measured", "device": "CPU reference", "driver": null, "capability_manifest": null},
  "scene": {"id": "two-tet-runtime", "hash": "0fc1a55a6843ce11", "seed": 12345},
  "configuration": {"copies": 100, "ray_count": 2048, "motion_amplitude": 0.10000000000000001, "visible_fraction": 0.65000000000000002, "inject_stub_corruption": false},
  "timings_ms": {
    "cage_deformation": 0.0019789999999999999,
    "transform_generation": 0.257521,
    "instance_generation": 0.002,
    "blas": null,
    "tlas": null,
    "synchronization": null,
    "traversal": 20.507270999999999,
    "shading": null,
    "total": 20.76398,
    "median": 20.76398,
    "p95": 21.209164999999999,
    "variance": 0.70831362878489945,
    "warmup_iterations": 5,
    "measured_iterations": 20
  },
  "memory_bytes": {
    "source_geometry": 212,
    "canonical_geometry": 288,
    "provenance": 320,
    "cage": 152,
    "blas": null,
    "tlas": null,
    "scratch": null,
    "instance_buffers": 23920,
    "api_objects": null,
    "renderer_state": null,
    "peak_total": null
  },
  "correctness": {"rays": 51200, "misses": 0, "duplicate_hits": 0, "wrong_ownership": 0, "position_error_max": 1.5462788545436253e-07, "normal_error_max": null, "attribute_error_max": 2.2909239782986646e-07, "image_error": null},
  "statistics": {
    "correctness_errors": 0,
    "corruption_detected": false,
    "dense_cpu_baseline": {
      "deformation_median_ms": 0.0075830000000000003,
      "traversal_median_ms": 1.7943125,
      "total_median_ms": 1.806521,
      "total_p95_ms": 1.9204999999999999,
      "oracle_ray_misses": 294,
      "provenance_mismatches": 0,
      "blas_update_ms": null,
      "blas_rebuild_ms": null,
      "note": "CPU geometry/traversal baseline only; no GPU performance conclusion"
    }
  },
  "failures": [
  ],
  "command": "./build/dev/tetcage_benchmark results/assets/two-tet-crossing.tetcage results/benchmarks/2026-07-27-cpu-stub.json --scene two-tet-runtime --seed 12345 --copies 100 --rays 2048 --warmup 5 --iterations 20 --motion 0.1 --visible 0.65",
  "evidence_class": "synthetic"
}
